{
  "version": "1.0",
  "目标时点": "2026-08-31",
  "源时点": {
    "上交所/深交所/北交所官网": "实时滚动发布；按采集日 T-1 抓取全量",
    "证监会eid.csrc.gov.cn": "实时滚动；按采集日 T-1 抓取全量",
    "公司公告/招股书": "披露日；正文标披露日",
    "上市公司财报": "按公司最新已披露报告期；源文件标期",
    "一级市场融资事件": "事件发生日（媒体口径），公告披露日为辅",
    "政策与事件": "事件日期升序，截止目标月（2026-08-31）自然月",
    "发射统计": "任务实际发射日，按 8 月自然月统计",
    "二级市场行情": "区间涨跌幅按 [2026-08-01, 2026-08-31] 区间计算",
    "QVeris 聚合器": "按聚合器返回的时间戳"
  },
  "正文脚注": "首页脚注写明采集日 + 目标时点（如：采集日 2026-08-31，目标时点 2026-08-31）"
}
