{
  "version": "1.0",
  "目标时点": "2026-07-31",
  "源时点": {
    "上交所/深交所/北交所官网": "实时滚动发布；按采集日 T-1 抓取全量",
    "证监会eid.csrc.gov.cn": "实时滚动；按采集日 T-1 抓取全量",
    "公司公告/招股书": "披露日；正文标披露日",
    "上市公司财报": "按公司最新已披露报告期；源文件标期",
    "一级市场融资事件": "事件发生日（媒体口径），公告披露日为辅",
    "政策与事件": "事件日期升序，截止上月自然月"
  },
  "正文脚注": "首页脚注写明采集日 + 目标时点（如：采集日 2026-08-31，目标时点 2026-07-31）"
}